{
  "messageId": "0192f1e9-5d02-7c52-8b2f-6e3a1d9f5b02",
  "type": "marketplace.sales_order.updated",
  "schemaVersion": 1,
  "source": "marketplace",
  "occurredAt": "2026-10-08T09:15:00Z",
  "data": {
    "salesOrderId": "SO-2026-000123",
    "recordVersion": 2,
    "updatedAt": "2026-10-08T09:15:00Z",
    "deliveryAddress": {
      "line": "Calle 21 de Calacoto 8790, casa 12",
      "reference": "Condominio Las Palmas, segunda garita",
      "location": { "latitude": -16.5421, "longitude": -68.0802 }
    }
  }
}
