{
  "messageId": "0192fcf6-07dd-70dd-8c00-3e9dbf5b7fed",
  "type": "dispatch.transfer.incident_reported",
  "schemaVersion": 1,
  "source": "dispatch",
  "occurredAt": "2026-10-12T14:30:00Z",
  "data": {
    "purchaseOrderId": "PO-2026-000087",
    "trackingCode": "DSP-2026-00051",
    "incidentId": "0192fcf6-0000-7000-8000-000000000001",
    "reasonCode": "INC-COMP-FAILURE",
    "reportedAt": "2026-10-12T14:22:05Z",
    "nextStep": "reschedule",
    "rescheduledWindow": { "startsAt": "2026-10-13T14:00:00Z", "endsAt": "2026-10-13T16:00:00Z" },
    "recordVersion": 2,
    "updatedAt": "2026-10-12T14:30:00Z"
  }
}
